{
  "schema": "heir.encoder_manifest.v1",
  "encoder_id": "hoptimus1_3592cb22",
  "availability": "available",
  "status_reason": "Access granted; config and safetensors checkpoint downloaded locally and SHA-256 verified on 2026-07-14.",
  "implementation": "timm_local",
  "repository": "bioptimus/H-optimus-1",
  "revision": "3592cb220dec7a150c5d7813fb56e68bd57473b9",
  "architecture": "vit_giant_patch14_reg4_dinov2",
  "config_filename": "config.json",
  "config_sha256": "b10c4f37ce804ff58bec7f2ffd35cc29ecbfdb2b96ac81f3c1b3e37e2b27616e",
  "checkpoint_filename": "model.safetensors",
  "checkpoint_sha256": "c4f1e5b457ddf00679626053b0bf2899be6a19c3a04ad191c87ad1cdfd1abfe1",
  "feature_width": 1536,
  "input_pixels": 224,
  "model_mpp": 0.5,
  "normalization": {
    "mean": [0.707223, 0.578729, 0.703617],
    "std": [0.211883, 0.230117, 0.177517]
  },
  "interpolation": "bicubic",
  "pooling_rule": "direct_features",
  "license": "CC-BY-NC-ND-4.0",
  "known_training_datasets": [],
  "evaluation_overlap": "unknown",
  "fine_tuning": "prohibited"
}
